country,province,title,variety,points,price,description
France,Burgundy,Bouchard Père & Fils 2006 Rugiens Premier Cru  (Pommard),Pinot Noir,93,95.0,"Classic Pommard, a big, firm, tannic wine that is foursquare and dominating. It broods with its dense structure and concentration. The fruits are solid, with plum skins, red berries and bursts of acidity. All this adds up to a wine that needs to age. Aim for five years before drinking."
France,Burgundy,Chanson Père et Fils 2005 Clos des Mouches Premier Cru  (Beaune),Pinot Noir,93,90.0,"This wine is rich, sweet, extravagant and, finally, elegant. Its ripe fruit flavors, red plums, sweet strawberries and smoky acidity all work together. The wine shows considerable concentration, but never loses sight of freshness. Age for another five years at least."
France,Burgundy,Bouchard Père & Fils 2006 Clos des Chênes Premier Cru  (Volnay),Pinot Noir,93,70.0,"A structured, relatively cool Volnay, dominated more by ripe tannins than by fruit. The fruit that is there is fresh, layered with acidity, juicy in texture, with cranberry and black plum skin flavors. The finish suggests red berries with its firmness. The wine demands at least five years' aging."
France,Burgundy,Chanson Père et Fils 2005 Grèves Premier Cru  (Beaune),Pinot Noir,93,75.0,"A beautifully perfumed wine, all herbs and smokiness. The palate sings the same tune, a rich, sensuous one, laced with more somber notes of dark, dry tannins. At the end of the day, this is already a delicious wine, but one that will really improve over 5–10 years."
France,Burgundy,Bouchard Père & Fils 2006  Corton,Pinot Noir,93,115.0,"Corton is the largest grand cru in Burgundy (all of 240 acres) and its style can vary widely. Bouchard has gone for a relatively soft style, emphasizing fruits, raspberry, myrtle and black currants, topped with acidity. It is a light, delicious wine, but probably not for aging."
France,Burgundy,Maison Champy 2006  Mazis-Chambertin,Pinot Noir,93,125.0,"A dense, almost heavy wine, with smoky, licorice flavors that dominate the fruit. It is firm, big, solid, the sort of wine that demands attention with its concentration and powered structure. It may need time for aging, but already the power and weight are there."
France,Burgundy,Albert Bichot 2006 Domaine du Clos Frantin  (Echézeaux),Pinot Noir,93,,"Spicy, smoky Lapsang Souchong tea aromas, pure acidity and juicy red plum flavors are all here in this big, but finely structured wine. The tannins are an essential part of the shape of the wine, but act as a support for its richness. The finish brings out the lively acidity of Pinot Noir. Age for five years."
France,Burgundy,Bouchard Père & Fils 2006 Caillerets Premier Cru Ancienne Cuvée Carnot  (Volnay),Pinot Noir,93,85.0,"The richness of the fruit from Caillerets is so evident in this scrumptious wine. With its big, bold black fruits, it has sweetness, a soft, generous texture and evocative perfumes. It is so delicious and ready to drink now, that even the acidity that shows through has a hard time reminding us that this wine should age as well."
France,Alsace,Domaine Barmès-Buecher 2014 Réserve Pinot Noir (Alsace),Pinot Noir,89,30.0,"The nose is very quiet but the body emanates a generosity despite its lightness. There is red-cherry fruit and a certain ampleness on a slender, fresh body. Tannins are like barely-there linens. The finish is wonderfully clean."
France,Burgundy,Domaine Faiveley 2014 Clos des Myglands  (Mercurey),Pinot Noir,89,48.0,"Fresh and packed with red fruits, this wine comes from the Faiveley domaine. With raspberry flavors and plenty of acidity, the wine is forward and going to develop quickly. Drink from 2018."
France,Burgundy,Jean-Luc and Paul Aegerter 2014  Pommard,Pinot Noir,89,68.0,"Even in a fruity year, Pommard lives up to its reputation for firm tannins. This wine will have delicious ripe black fruits, although not just yet. The structure and the dark tannins are up front, leaving tantalizing hints of the richness to come. Drink from 2019."
France,Burgundy,Domaine A. Machard de Gramont 2014 Les Damodes Premier Cru  (Nuits-St.-Georges),Pinot Noir,89,80.0,"From vines in the north of the Nuits Saint-Georges, close to Vosne-Romanée, this is a structured wine. It has ripe berry fruits and acidity that are still developing through the firm, dry tannins. The wine is still young and needs to age, so drink from 2019."
France,Burgundy,Domaine de Suremain 2014  Mercurey,Pinot Noir,89,34.0,"This wine is smoky yet fresh and juicy. It has a light touch of red-currant fruits, a crisp texture and bright acidity. The tannins are gentle, leaving pride of place to the natural fruitiness of the wine. Drink from 2017."
France,Southwest France,Château de Gayon 2009 Dou Hauret Red (Madiran),Red Blend,91,50.0,"In this ripe, smooth wine, the fruit dominates the tannic structure. Black fruits, dense plums and blackberry flavors are rich and concentrated. The firmer underlay is dark, brooding and promises good aging. This is not a shy wine and it will also need aging, so drink from 2018."
France,Languedoc-Roussillon,Domaines Astruc 2007 dA Reserve Pinot Noir (Vin de Pays d'Oc),Pinot Noir,84,10.0,Six months in oak barrels have given the nose of this wine a lovely overlay of mocha and coffee on top of the cherry fruit. Raspberry flavors dominate the mouth while vanilla and strawberry linger on the finish. Lush acidity and only the barest remnant of tannin make this a good choice forwhite fish in a fruit-based sauce.
France,Languedoc-Roussillon,Little Black Dress 2006 Pinot Noir (Vin de Pays d'Oc),Pinot Noir,84,10.0,"A top choice in a generally weak category, this Pinot shows pretty strawberry and raspberry scents that yield to earth and cherry flavors in the mouth. The palate is well balanced and followed by a strawberry-infused finish. Although this wine shows quite a bit of promise, some slightly gummy notes on the nose and palate preclude a higher score at this time."
France,Southwest France,Cave du Marmandais 2012 Château Bazin Red (Côtes du Marmandais),Red Blend,88,45.0,"This rich, full-bodied wine is packed with ripe, dense blackberry and plum flavors. With firm tannins in the background, it is always going to be dark and solid. Produced on a single vineyard by the local cooperative, it could still age and will be best from 2016."
France,Burgundy,Labouré-Roi 2015 Les Marconnets Premier Cru  (Savigny-lès-Beaune),Pinot Noir,91,50.0,"Although this wine is tight with tannins and wood aging, it shows the softer side of the appellation with its ripe red berry fruit. Needing more time in bottle to deliver the opulence of its fine Premier Cru vineyard, it will be best from 2022."
France,Languedoc-Roussillon,Villa Noria 2010 Cabernet Sauvignon (Pays d'Oc),Cabernet Sauvignon,85,,"The deep red-black color reaches from core to rim. The fragrant nose centers around hot chocolate and candied cherries. Dry on the attack with adequate acidity, the wine shows moderate extraction and medium alcohol that lead to a short finish."
France,France Other,Henri Milan 2010 Sans Soufre Ajouté Red (Vin de France),Red Blend,85,35.0,"A wine with only natural sulfur, it feels lean, with piercing acidity and firm tannins. It is young and all the elements should fall into place, but with the fruit's stalky character the wine will always be dry."
France,Burgundy,Domaine de la Ferté 2008 Servoisine Premier Cru  (Givry),Pinot Noir,90,34.0,"With some richness, red fruits over wood and a full-bodied structure, this is a solid, dense wine. Acidity is present, while the ripe juicy fruits more than balance it. The tannins offer a firm structure and suggest aging."
France,Burgundy,Henri de Villamont 2007 Les Feusselottes Premier Cru  (Chambolle-Musigny),Pinot Noir,90,,"This is a delicate wine, sweet strawberry and elegant structure combining over a soft texture. There is a hint of smokiness as an addition to the finely rounded aftertaste."
France,Burgundy,Albert Bichot 2015 Domaine du Pavillon Clos des Ursulines  (Pommard),Pinot Noir,94,79.0,"The wallled Clos des Ursulines is wholly owned by this producer. This perfumed wine is showing strong wood aromas as well as concentrated spice. Underneath, the generous juicy fruit has a fine balance between red plums and bright acidity. Drink from 2022."
France,Burgundy,Jean-Luc and Paul Aegerter 2015  Corton Vergennes,Pinot Noir,94,,"From one of the parcels that make up the larger Corton Grand Cru, this is a powerful wine with a proper sense of its dignity. It is stylish as well as rich—an elegant blending of ripe red fruits, tannins and acidity. The wine of course has great potential and will not be ready to drink until 2025."
France,Burgundy,Henri de Villamont 2015 Renardes  (Corton Les Renardes),Pinot Noir,94,,"This is a powerful wine with concentration and dark tannins. It is rich, packed with black fruits and acidity. The wine has spice, a bold structure and a great future. The wine, from one of the vineyards within the Corton Grand Cru, is likely to be ready to drink from 2025."
France,Burgundy,Alex Gambal 2011 Cuvée des Deux Papis  (Bourgogne),Pinot Noir,88,30.0,"Rich red fruits combine with good acidity, raspberry flavors and soft tannins. Ripe and juicy, it shows great fruitiness at the end."
France,Burgundy,Arnoux & Fils 2011 Les Pimentiers  (Savigny-lès-Beaune),Pinot Noir,88,,"Ripe and jammy, it's full of red fruit jelly flavors. It has just enough tannic structure to support the fruit, giving balance with a dry core and fragrant acidity. It's rich, full in the mouth and needs time. Drink from 2017."
France,Burgundy,Bouchard Père & Fils 2011  Monthélie,Pinot Noir,88,45.0,"This is a ripe and fruity wine, with soft tannins and rich raspberry fruits. Already accessible, it's very full in the mouth, wonderfully juicy and jammy, yet with some freshness at the end."
France,Burgundy,Jean-Luc and Paul Aegerter 2011 Les Vaucrains Premier Cru  (Nuits-St.-Georges),Pinot Noir,88,148.0,"A fragrant wine, it offers truffle and red fruit aromas. The palate is ripe although it does have intense acidity, more bright red fruits than firmer structure. It feels almost ready to drink, fruity and fresh."
France,France Other,Château d'Aydie 2013 Aramis Red (Vin de France),Red Blend,85,10.0,"A fruity blend of Tannat, Syrah and Cabernet Franc that has berry fruits, a stalky texture and touches of wood spice. It's an easy, juicy wine, made fresh and ripe to be drunk now."
France,Languedoc-Roussillon,Château du Donjon 2003 Cuvée Prestige Red (Minervois),Red Blend,87,17.0,"This blend of 60% Syrah, 40% Grenache starts off with scents of charred beef and smoke, then adds coffee and blackberry flavors to give it plenty of complexity. The tannins are soft, lingering on the finish with traces of caramel and vanilla. Drink it now and over the next few years."
France,Loire Valley,Hubert Veneau 2010 Red (Coteaux du Giennois),Red Blend,87,,"A delicious bone dry rosé, so fresh and lively with its vivid acidity lightening up the red fruits and offering great accompaniment to so many dishes."
France,Languedoc-Roussillon,Château de Lancyre 2003 Pic Saint-Loup Vieilles Vignes Red (Coteaux du Languedoc),Red Blend,86,20.0,"Starts with clean cedary aromas and bold cassis scents, then slowly works in flavors of coffee, licorice and earth. It's medium- to full-bodied, with a dusty, tannic finish. Hold a couple of years, then try with stews or braises."
France,Burgundy,Albert Bichot 2006 Domaine Adélie Les Champs Martin Premier Cru  (Mercurey),Pinot Noir,86,,"Soft, jammy, forward wine, that exhibits sweet strawberries, a generous structure, and only light tannins. Drink now."
France,Loire Valley,Fournier Père et Fils 2010 No 22  (Sancerre),Pinot Noir,90,85.0,"A very rich and smooth Pinot Noir that is impressively concentrated. It has rich, structured fruit and fragrant acidity, red plums and a sense of tannin. This could certainly age, so drink after 2015."
France,Burgundy,Alex Gambal 2013 Les Picotins  (Savigny-lès-Beaune),Pinot Noir,89,40.0,"With a good sense of structure, this bottling, formerly called Vieilles Vignes, comes from 55-year-old vines. It is textured, with some firm tannins as well as ripe plum flavors and acidity. The wine is still developing and will be better from 2016."
France,Burgundy,Domaine Jessiaume 2010 Brouillards Premier Cru  (Volnay),Pinot Noir,91,66.0,"Rich and full, this wine shows some sense of structure. It has considerable acidity and flavors of cherry and red currant. With the dry tannins coming through on the finish, it will need some years to soften."
France,Burgundy,Albert Bichot 2010 Domaine du Pavillon Rugiens Premier Cru  (Pommard),Pinot Noir,91,,"Rugiens,  which is named after its red soil, is located in the south of Pommard. Dense, structured and powerful, this is a brooding wine that has concentrated tannins and fruit that is offset by a tight line of acidity. This is a wine that demands aging."
France,Burgundy,Domaine Faiveley 2009 Clos des Myglands Premier Cru  (Mercurey),Pinot Noir,89,40.0,"Expect ripe and open fruit from this Faiveley owned vineyard in Mercurey. The wine tastes soft, the tannins well integrated into the ripe cherry and berry fruits. It could age, but it is ready to drink now."
France,France Other,Clos Teddi 2006 Rouge Red (Patrimonio),Red Blend,86,25.0,"A blend of the local Niellucciu and Sciaccarello grapes, this is a robust wine, with rustic tannins, blackberry acidity and a firm dry core. A great barbecue wine, finishing very fresh with a layer of wood."
France,Burgundy,Domaine Jacques Prieur 2009 Santenots  (Volnay),Pinot Noir,88,128.0,"Produced from young vines, this fresh, fruity wine offers immediate pleasure, with red berries and sweet fruit flavors over a spicy layer of wood and a soft, generous texture."
France,Burgundy,Roux Père et Fils 2009 Bearegard  (Santenay),Pinot Noir,88,46.0,"Like a freshly picked cherry, all juicy fruit with sweet perfumes and a jammy, ripe character. The wine is soft, open and already accessible."
France,Burgundy,Château de Santenay 2013 Les Brunettes et Planchots  (Aloxe-Corton),Pinot Noir,90,80.0,"Produced from two parcels in Aloxe Corton, this structured wine has red-plum fruitiness that is still masked by a dry tannic coating. It has concentration and good potential. Drink this textured, firm wine from 2018."
France,Burgundy,Philippe Jeannot 2015 Quentin Jeannot La Fussière Premier Cru  (Maranges),Pinot Noir,88,30.0,This is a pale-colored wine with a soft texture and gentle strawberry fruits. The texture comes through slowly to give a firmer edge to what is a wine for medium-term aging. This is stylish and smooth. It should be drunk from 2018.
France,Burgundy,Nicolas Potel 2014 Les Marconnets Premier Cru  (Savigny-lès-Beaune),Pinot Noir,90,60.0,"This wine comes from one of the best vineyard sites in Savigny-lès-Beaune, on the slope closest to Beaune. It is a smooth, perfumed and ripe wine that has a balanced structure under the bright red-cherry flavor. Still bursting with young fruit, the wine will age, so wait to drink until 2019."
France,Burgundy,Chanson Père et Fils 2013 Dominode Premier Cru  (Savigny-lès-Beaune),Pinot Noir,90,68.0,"Damaged by hail in 2013, the vineyards yielded low quantities. The grapes harvested produced a wine with crisp red fruits and bright berry acidity. The fresh, tight aftertaste suggests the wine will age. Drink from 2019."
France,Southwest France,Domaine D'en Ségur 2008 Red (Côtes du Tarn),Red Blend,86,13.0,"A blend of Merlot and Duras, the red grape of Gaillac. The combination creates a meaty and chewy wine, with pepper and red-currant flavors. While the Merlot supplies the warmth, the Duras offers acidity and fruitiness. Drink now."
France,Burgundy,Domaine Jessiaume 2007 Bourgogne Pinot Noir  (Burgundy),Pinot Noir,84,,"Certainly light, but also deliciously fruity, with raspberries a dominant flavor in the juicy acidity and the softest, velvet tannins. Drink now."
France,Burgundy,Manuel Olivier 2009  Hautes Côtes de Nuits,Pinot Noir,85,17.0,"Warm, ripe and round, this red-fruited wine has a fine feeling of richness. It is soft and fruity, with just the right amount of acidity to balance. Ready to drink."
France,Burgundy,Domaine Guy & Yvan Dufouleur 2009 Clos du Chapitre Premier Cru  (Fixin),Pinot Noir,85,68.0,"While the texture is rich and full-bodied, there is an edge of sharp acidity that takes away from the generous ripeness. Tannins and juicy red fruits are present, but the acidity is a little jarring."
France,Burgundy,Domaine Faiveley 2009 Les Rugiens Premier Cru  (Pommard),Pinot Noir,91,115.0,"Sweet new wood goes with rich plum skins in a wine that has a firm structure. The richness of the wine revolves around sweet cherries and juicy acidity. With the wood still dominant, it needs at least five years to settle down."
France,Burgundy,Joseph Drouhin 2009  Pommard,Pinot Noir,91,50.0,"A solid wine, with plum skin and dry tannin textures. It does have the ripe fruit of 2009, attractive red fruits and juicy acidity. But it needs aging over at least three years to show its fruitiness."
France,Burgundy,Vignerons de Buxy 2008 Buissonnier  (Bourgogne),Pinot Noir,83,15.0,"A lightweight wine, almost tangy in its freshness. Wild strawberry flavors give a great liveliness to a wine that is taut in its acidity."
France,Burgundy,Domaine Champy 2010  Volnay,Pinot Noir,87,,"Ripe and round, this has a strawberry flavor that is surrounded by dense tannins. It shows a fine line of fresh acidity, and it is ready to drink, although it will age for several years."
France,Burgundy,Domaine Champy 2010  Chorey-lès-Beaune,Pinot Noir,86,,"This underrated village, which is located next to Savigny-lès-Beaune, has produced an attractive, fruity wine that has a fine structure, a red berry flavor and a twist of acidity on the finish. Keep this for 2–3 years."
France,Alsace,Domaine Michel Fonne 2013 Tradition Pinot Noir (Alsace),Pinot Noir,86,17.0,"Pure red fruit seems to have a bruised apple edge. The palate is simple and easy-drinking and despite its pretty ruby color comes across as a rosé, with barely a touch of tannin. Chill this for a surprise at a party."
France,Alsace,Domaine Sipp-Mack 2013 Tradition Pinot Noir (Alsace),Pinot Noir,86,27.0,"Simple, but up-front strawberry fruit reigns on nose and palate of this very light-bodied red. The palate is soft, easy, dry and fresh and would take very well to chilling on a warm day."
France,Loire Valley,Domaine Vacheron 2008  Sancerre,Pinot Noir,90,,"Vacheron are masters of red Sancerre, and this wine lives up to the billing. There are impressively ripe fruits, flavors of the brightest berries and a sweet, pure character, emphasized by the acidity and underlined by wood."
France,Burgundy,Louis Jadot 2013 Les Estournelles Saint-Jacques Premier Cru  (Gevrey-Chambertin),Pinot Noir,94,133.0,"This wine is dark and dense, very closed at this young stage. But wait for that rich fruit to burst out to give its intense acidity and ripeness to the wine. It's a powerhouse of flavors, spice and dark minerality. Drink from 2022."
France,Burgundy,Louis Jadot 2013 Theurons Premier Cru  (Beaune),Pinot Noir,94,62.0,"This wine is dark, with a strong sense of structure. Dense black fruits are cut with strawberry acidity and a dark tension between fruit and firm tannins. The coiled power will allow this beautiful wine age for many years. Drink from 2020."
France,Burgundy,Henri de Villamont 2012  Corton Les Renardes,Pinot Noir,93,,"More structure and less fruit is the characteristic of this wine. A dry core is very present, giving a tough edge at this stage. There are the hints of red fruits and powerful acidity that will develop. With its weight, this is a wine for the long term. Drink from 2019."
France,Burgundy,Joseph Drouhin 2012 Premier Cru  (Chambolle-Musigny),Pinot Noir,93,113.0,"Ripe and full of raspberries, this has a structure well cushioned by the ripe texture. The wine is packed with acidity while having a sense of floral, aromatic fruitiness. From four different parcels in premier cru, this seductive wine will also age well. Drink from 2018."
France,Burgundy,Alex Gambal 2013 Grèves Premier Cru  (Beaune),Pinot Noir,93,57.0,"From one of the top Premier Cru vineyards in Beaune, this structured wine shows concentration and richness. Packed with tannins in its center, it is cushioned by the generous red berry and cherry fruits. The wine has a finely perfumed aftertaste. Drink from 2018."
France,Burgundy,Alex Gambal 2013  Vosne-Romanée,Pinot Noir,93,85.0,"From vines close to the Sachets Premier Cru vineyard, this wine is powerful, structured and dense, despite the relatively low alcohol that gives it a lift of red fruits, acidity and perfume. It is still developing, a wine in progress, as its backbone of tannins softens. Drink from 2018."
France,Burgundy,Albert Morot 2012 La Bataillère aux Vergelesses Premier Cru  (Savigny-lès-Beaune),Pinot Noir,87,61.0,"For the wine and its fruit, there is too much firm extract here. It brings out very dry tannins and licorice flavors that cover the fruit. It's going to be a difficult wine to soften."
France,Alsace,Emile Beyer 2009 Cuvée de l'Hostellerie Pinot Noir (Alsace),Pinot Noir,85,,"Bitter cherries and dark, tarry flavors mark this wood-aged Pinot Noir. There is a strong new wood character that gives some bitterness. The wine needs another year to soften."
France,Alsace,Robert Klingenfus 2010 Signature Pinot Noir (Alsace),Pinot Noir,85,15.0,"Bitter cherry flavors mark a wine that is light in texture, with attractive acidity and a soft, fruity red berry finish. Not for aging."
France,Southwest France,Alain Brumont 2007 Château Bouscassé Argile Red (Madiran),Red Blend,93,,"A parcel of fine red clay in the Bouscassé vineyard is the inspiration behind this wine. That gives both richness and a strongly mineral character that brings out a distinct texture and considerable acidity. The wine is dark, brooding, still with plenty of fresh fruits. Almost ready to drink, it will always have powerful tannins and acidity. Decanting this wine is essential."
France,Burgundy,Domaine Luc et Lise Pavelot 2011  Pernand-Vergelesses,Pinot Noir,88,30.0,"This is a firm style of wine, showing the mineral character of Pernand-Verglesses reds. The wine has a nervy, almost herbal profile, showing red currants and considerable acidity."
France,Burgundy,Manuel Olivier NV Brut Rosé  (Crémant de Bourgogne),Pinot Noir,88,20.0,"Made 100% from Pinot Noir, this delicious rosé has fine red fruits, a great clean streak of acidity and a light touch of tannin to give structure. Very pure, very fresh."
France,Burgundy,Pierre André 2009  Aloxe-Corton,Pinot Noir,88,,"From the home village of Pierre André's Château Corton-André, this is a solid, chunky wine, its tannins very prevalent at this stage. It promises to be a smoother, wood-aged sip with blackberry and spice as well as a tasty juiciness."
France,Alsace,Charles Sparr NV Brut Rosé Pinot Noir (Crémant d'Alsace),Pinot Noir,85,23.0,"Pure Pinot Noir has produced a full, fruity sparkling wine. It is lightly crisp, fresh with wild strawberries and acidity. The aftertaste, soft and rounded, has a satisfying creamy character."
France,Burgundy,Vignerons de Buxy 2011 Clos Jus Premier Cru  (Givry),Pinot Noir,85,,"This is a fresh Pinot Noir with plenty of crisp red fruits and soft tannins. It's all about fruitiness, with a character that demands to be drunk now."
France,Burgundy,Derey Frères 2012 Les Vignes Marie  (Marsannay),Pinot Noir,85,35.0,"This perfumed wine offers plenty (perhaps too much) acidity and red fruits, with only light tannins. That makes for a fruity wine, fresh and ready to drink now and until 2018."
France,Burgundy,Manuel Olivier 2011 Vieilles Vignes  (Bourgogne Hautes Côtes de Nuits),Pinot Noir,85,30.0,"The light color of 2011 is evident in this bottling. It follows through to a soft, rounded, fruity wine that is lightly textured. Acidity and juicy red fruits offer a wine that is drinkable now."
France,Burgundy,Manuel Olivier 2012  Bourgogne Hautes Côtes de Nuits,Pinot Noir,85,24.0,"Fruit and tannins harmonize in this ripe, soft wine. Attractive red berry fruits and lively acidity partner with a smooth texture. It's not a wine for aging, and will be ready to drink from 2015."
France,Burgundy,Alex Gambal 2013  Vougeot,Pinot Noir,92,85.0,"There are not many village wines made in Vougeot with the large areas devoted to Premier and Grand Cru. This wine has reminiscences of the structure of those top wines although it is delicious in its fragrant strawberries, full and with just the right amount of acidity. The fruit comes from the Clos du Château. Drink from 2018."
France,Burgundy,Henri de Villamont 2012  Grands-Echezeaux,Pinot Noir,92,,"Very dense, this wine has some bitter extract and layers of wood that give it a very firm structure. While there is acidity, the wine also has a dark character that is hard and powerful. It is likely always to be a solid wine. Drink from 2020."
France,Burgundy,Domaine Faiveley 2014 Clos du Roy Premier Cru  (Mercurey),Pinot Noir,90,56.0,"With some firm structure behind the red fruits, this wine will have a good future. A dry core sustained by the acidity is waiting to burst out and give a ripe, fruity while always fresh wine. Drink from 2018."
France,Alsace,Domaine Fernand Engel 2013 Cuvée Fernand Pinot Noir (Alsace),Pinot Noir,90,30.0,"The nose is reminiscent of dried pine cones and miso. It is only on the palate that some fruit appears: Hints of red cherry mix with the same pine notes and are fringed with pleasant bitterness. The palate is light in weight but concentrated. This calls out for food—think game and mushroom dishes. The finish is juicy, refreshing and moreish."
