country,province,title,variety,points,price,description
France,Burgundy,Roche de Bellene 2012 Aux Boudots Premier Cru  (Nuits-St.-Georges),Pinot Noir,93,124.0,"Made from 60-year-old vines from a property next door to Vosne-Romanée, this wine is both structured and rich. It has dark tannins, with juicy and jammy plum fruits that are layered with acidity. It is still firm, dense and needs time. Drink from 2020."
France,Burgundy,Roche de Bellene 2012 Les Marconnets Premier Cru  (Savigny-lès-Beaune),Pinot Noir,93,56.0,"The Marconnets vineyard on the slopes above Savigny-lès-Beaune produces some of the most perfumed wines in the appellation. This is typical, a wonderful medley of juicy, fruity aromas. It is still young, although temptingly attractive now. Drink ideally from 2018."
France,Burgundy,Roche de Bellene 2012 Pitures Premier Cru  (Volnay),Pinot Noir,93,92.0,"This beautifully perfumed wine has rounded tannins finely integrated into the opulent red cherry fruit. It's already a delicious wine, juicy and fragrant, although still with a long future. If you can wait, drink it from 2018."
France,Burgundy,Roche de Bellene 2012 Vieilles Vignes  (Morey-Saint-Denis),Pinot Noir,93,68.0,"Closed up and just hinting at its great potential, this wine is showing tannins and a dry, solid core. Slowly it reveals delicious, opulent red berry fruits and concentrated texture. It needs a lot of time before drinking; wait until 2019."
France,Burgundy,Roche de Bellene 2012 Vieilles Vignes  (Vosne-Romanée),Pinot Noir,93,86.0,"With its wonderful poise between dark structure and intensely fragrant fruit, this is firm, dry and packed with ripe blackberry fruits. It has great potential, as befits a concentrated wine from Vosne-Romanée, and is certainly not ready to drink before 2020."
France,Burgundy,Jaffelin 2009 Sur les Grèves Clos Saint-Anne Premier Cru  (Beaune),Pinot Noir,92,57.0,"Big, bold and cuddly, this wine's tannins are cushioned by the red berry fruit and attractive acidity. It has weight and a rich feeling, and the dry edge offers the possibility of aging. This small clos is exclusive to Jaffelin."
France,Burgundy,L. Tramier & Fils 2009 Collection  (Corton),Pinot Noir,92,93.0,"This is a closed, smoke-filled wine, and its tannins and toasty wood character currently dominate, which gives it a bitter edge. It has richness, with hints of juicy fruit that sit under the structure. Give it at least six years."
France,Burgundy,Domaine Champy 2010  Corton-Rognet,Pinot Noir,92,,"Currently dominated by tannins, this wine is rich and structured, and it demonstrates the potential of its huge fruit and weight. The final note of this age-worthy wine is smokiness from wood aging."
France,Burgundy,Albert Bichot 2010 Lavaux Saint-Jacques Premier Cru  (Gevrey-Chambertin),Pinot Noir,92,,"This wine shows the structured side of Gevrey-Chambertin. The vineyard is situated at the opening of a small side valley, a location that allows the grapes to ripen slowly. This is elegant and structured, and it's full of solid tannins as well as cherry and red berry flavors. Age this for 7–8 years."
France,Burgundy,Alex Gambal 2014  Volnay,Pinot Noir,91,68.0,"A normal five-barrel production was cut to two because of hail. This wine is firm, with hints of the generosity of the appellation waiting behind the dry texture. It's structured, with acidity and plum skins that will take some time. Drink from 2019."
France,Burgundy,Bouchard Aîné et Fils 2014 Clos du Roi Premier Cru  (Beaune),Pinot Noir,91,69.0,"This is a juicy wine, packed with red fruits. It has acidity along with an edge of tannins. The attractive fruitiness suggests the wine will develop quickly. Drink from 2019."
France,Burgundy,Château de Santenay 2014 Les Brunettes et Planchots  (Aloxe-Corton),Pinot Noir,91,55.0,"Old vines planted in a small parcel at the base of the Corton hill give this ripe and rich wine. Full of jammy fruit, it has structure as well as strawberry and red-cherry flavors, packed with juiciness that comes from the acidity. This wine has a good future. Drink from 2020."
France,Burgundy,Louis Latour 2014 Epenots Premier Cru  (Pommard),Pinot Noir,91,120.0,"This wine has both structure and ripe red-plum fruits. It is dark and dense, solid and with good acidity. A clear line of freshness promises a good future. This needs time, so don't drink before 2020."
France,Burgundy,Domaine Coquard Loisson-Fleurot 2014  Vosne-Romanée,Pinot Noir,91,70.0,"This family domaine has produced a rich, structured wine from its holding in Vosne-Romanée. It is firm, dark and concentrated with rich tannins and red-berry fruit. Spice, acidity and a dense aftertaste promise aging. Drink from 2018."
France,Languedoc-Roussillon,Les Vignerons de la Méditerranée 2010 Réserve St. Martin Pinot Noir (Pays d'Oc),Pinot Noir,85,8.0,A lovely floral streak adds interest to the bright red-berry and ripe rhubarb aromas. Cherry-skin and rich strawberry flavors fill the palate and remain through the clean finish. Light weight with soft tannins and an easy demeanor.
France,Languedoc-Roussillon,The Frenchhouse 2010 Pinot Noir (Vin de Pays d'Oc),Pinot Noir,85,10.0,"Jammy strawberry and raspberry notes fill the nose and mouth, and a soft accent of chocolate-covered cherry adds just the right amount of decadence. A slight peppery lift keeps things vibrant on the finish."
France,Burgundy,Maison Champy 2008 Les Taillepieds Premier Cru  (Volnay),Pinot Noir,91,,"A smoky, intensely flavored wine that is ripe and opulent. The tannins are beautifully integrated into the powerful texture of sweet berry fruits, intense acidity and sumptuous aftertaste. Age for 3–4 years."
France,Burgundy,Henri de Villamont 2008 Les Feusselottes Premier Cru  (Chambolle-Musigny),Pinot Noir,91,,"Fine, elegant wine, packed with delicious strawberry flavors, sweetness and richness. At the core are firm tannins, but these are almost crowded out by the ripe fruit."
France,Burgundy,Jean-Claude Boisset 2011 Les Grèves Premier Cru  (Beaune),Pinot Noir,92,40.0,"Always a popular vineyard, Beaune Grèves has produces a full, ripe, intense wine. It shows some signs of wood aging as well as rich strawberry and red plum. It's delicious already, but this full and complex wine deserves aging. Drink now –2025."
France,Burgundy,Domaine Poulleau Père et Fils 2013  Volnay,Pinot Noir,88,,"This is young to release a Volnay, as this wine shows in its taste. It is almost shocking in its fresh acidity and red fruits, disclosing tannins and a drier side. Some juiciness will develop as the wine matures. Wait until 2017."
France,Burgundy,Joseph Drouhin 2012  Côte de Nuits-Villages,Pinot Noir,88,31.0,"The purity of the Pinot Noir in this wine is outstanding. It may not be particularly complex, but the beautiful ripe red cherry fruit is so good. Drink now, or keep until 2020."
France,Burgundy,Bouchard Père & Fils 2007  Monthélie,Pinot Noir,87,35.0,"Soft, lilting wine that is gentle, ripe and ready to drink. The fruits have some sweetness, the tannins are light, and the acidity is fresh and never too intrusive."
France,Alsace,Domaine Marcel Deiss 2013 Rouge Red (Alsace),Red Blend,91,27.0,"This is not an obvious wine, but one that creeps up slowly, takes time and impresses quietly. It delivers depth rather than power. Glints of pepper and allspice shine amid the restrained red, tart cherry fruit. The slightest of tannic grips stems from concentration rather than extraction. It's elegant Alsace Pinot, quiet but firm."
France,Burgundy,Domaine René Bouvier 2014 Les Longeroies  (Marsannay),Pinot Noir,91,,"This rich, almost jammy wine is given structure by the darkly tannic character. The dry, firm, toasty structure is pulled forward by the red-berry acidity that indicates a good future for the wine. Drink from 2020."
France,Burgundy,Faiveley 2014 Les Charmes Premier Cru  (Chambolle-Musigny),Pinot Noir,91,153.0,"This wine is soft and rounded with attractive red-cherry fruits, ripe strawberries and touches of wood and tannin. Acidity comes along behind this richness. It is going to develop quickly and will give great pleasure. Drink from 2018."
France,Southwest France,Domaine Rotier 2014 Les Gravels Red (Gaillac),Red Blend,90,17.0,"This crisp blend of Braucol and Syrah comes from a gravel terrace. While it has fine acidity, the wine also has ripe red fruits, sweet plum flavors and an attractive sprinkling of spice. Drink this wine from 2017."
France,Languedoc-Roussillon,Labouré-Roi 2010 Les Sangliers Pinot Noir (Pays d'Oc),Pinot Noir,85,12.0,"The fruit isn't the star of this wine; instead, intense notes of forest floor and cola spice dominate the nose and palate. Sure, the red berry and cherry flavors are there, but they're just hanging in the background of this bright yet herbaceous selection."
France,Languedoc-Roussillon,Arrogant Frog 2010 Lily Pad Noir Pinot Noir (Pays d'Oc),Pinot Noir,85,9.0,"Vibrant notes of red cherry, plum and blueberry are partnered with earthy hints of forest floor and cocoa. This is a solid selection that's perfect for entertaining. It's well balanced, with light tannins, lifted acidity and a medium-length, black-pepper-kissed finish."
France,Burgundy,Louis Max 2013 Les Lièvres  (Nuits-St.-Georges),Pinot Noir,91,61.0,"Firmly structured, this wine will be equally packed with ripe fruit. While the toast and tannin flavors soften, wait for those rich red plum and cherry tastes to come through. Balanced and solid, this dense wine should be drunk from 2018."
France,Burgundy,Jaffelin 2010  Nuits-St.-Georges,Pinot Noir,88,55.0,"This wine is chunky and firm, and its lively red fruit brings freshness. With its dry core and touch of toast on the finish, this could age for a couple of years."
France,Burgundy,Domaines Devillard 2011 Château de Chamirey Champs Martin Premier Cru  (Mercurey),Pinot Noir,92,,"Dark, dense and tannic wine, very firm. The youthful structure covers the red fruits and acidity, promising much though for the future. The wine has a potential of elegance, balance and richness. Drink from 2018."
France,Burgundy,Domaines Devillard 2011 Château de Chamirey Les Cinq Premier Cru  (Mercurey),Pinot Noir,92,,"A blend from five of the Mercurey Premier Crus, a rich full-bodied wine, with elegant ripe fruits, red cherry flavors and spice. The wine is fresh, perfumed as well as solidly constructed with firm final tannins. Drink from 2017."
France,Burgundy,Henri de Villamont 2012 Le Village  (Savigny-lès-Beaune),Pinot Noir,87,,"This wine is soft and ripe, with some attractive strawberry-jam flavors and fresh acidity. The rounded texture is already attractive, although the wine will be better from 2017, when it will have filled out."
France,Burgundy,Vignerons de Mancey 2013 Cuvée Agnès de Couëdic  (Mercurey),Pinot Noir,87,25.0,"Already this wine is so smooth that it is quite ready to drink. With its berry fruit flavors that are lifted by acidity, it is well balanced between mineral tannins and fruitiness. The aftertaste is full and round."
France,France Other,Clos Teddi 2014 Grande Cuvée Red (Patrimonio),Red Blend,91,36.0,"Just maturing, this is a rich, wood-aged wine. Its tannins have softened and melted into its ripe dark plum and black fruit flavors and concentrated structure. A serious wine, it's powered by a dry core and rich fruitiness. Drink from 2018."
France,Bordeaux,Ignatus 2016  Bordeaux,Cabernet Sauvignon,87,10.0,"This finely balanced wine is poised between spicy wood notes and black currant fruit. It's lightly structured with fine tannins and plenty of juicy acidity. Although young, it has been made to drink now."
France,Southwest France,Château Bouissel 2008 Classic Red (Fronton),Red Blend,84,13.0,"A lean wine, its tannins dominant. There is a barnyard character along with red cherry fruit and acidity. An edge of wood and toast comes through at the end."
France,Alsace,Vignoble des 2 Lunes 2012 Poussière d'Étoiles Pinot Noir (Crémant d'Alsace),Pinot Noir,89,28.0,"Very soft, faint strawberry nose hints at freshness and summery fruit. The palate foams frothily but carries some bitter edges. Nonetheless, the lemony core makes this zero dosage a refreshing, light-hearted apéritif."
France,Burgundy,Manuel Olivier 2008  Gevrey-Chambertin,Pinot Noir,91,39.0,"Dark colored and powerful, this is a great expression of the more massive side of Gevrey Chambertin. The wine is dense, dark, with black plum and fig flavors, leavened with attractive juicy acidity. Tannins thread through the acidity. Age for 2–3 years."
France,Champagne,Gremillet NV Blanc de Noirs Brut Pinot Noir (Champagne),Pinot Noir,91,49.0,"Hailing from the southern Aube region, where Pinot Noir ripens well, this Champagne is rich and full, with hints of red fruit, zesty orange and lemon-tinged minerality. The acidity is bright and fruity, highlighting the wine's attractive texture. Drink now."
France,Burgundy,Joseph Drouhin 2010 La Forêt  (Bourgogne),Pinot Noir,87,17.0,"Attractively ripe, this has fruity red-berry flavors along with acidity and soft tannins. This is ready to drink now."
France,Burgundy,Nuiton-Beaunoy 2010 Réserve  (Bourgogne),Pinot Noir,87,19.0,"This is warm and round, with red fruit flavors that are attractively displayed against a backdrop of soft tannins. The acidity lends crispness, highlighting the ripe fruit on the finish."
France,Burgundy,Vignerons de Buxy 2010 Buissonnier  (Côte Chalonnaise),Pinot Noir,85,16.0,"This is light and fruity, with its red fruit upfront. The tannins are balanced, in keeping with the wine's perfumed nature. The youthful acidity on the finish is likely to soften out in a year."
France,Burgundy,Louis Latour 2012 Les Cazetiers Premier Cru  (Gevrey-Chambertin),Pinot Noir,92,120.0,"This wine has a firm structure, solid with tannins and a dense, complex balance between acidity and perfumed red berry flavors. It is juicy, full of freshness as well as considerable tannins. It needs to be aged for several years; drink from 2019."
France,Burgundy,Louis Max 2013 Les Azerottes  (Gevrey-Chambertin),Pinot Noir,92,90.0,"Rich and concentrated, this wine shows the firm tannins of a Gevrey-Chambertin. Ripe berry fruits and beautiful acidity contrast with this structure. The fresh aftertaste with its flavors of raspberries and dark cherries will be very fine. Drink from 2018."
France,Burgundy,Domaine Perrot-Minot 2010 La Richemonne Premier Cru  (Nuits-St.-Georges),Pinot Noir,93,,"Made from grapes that were sourced from vines close to Vosne-Romanée, this has all of the structure of a Nuits-St-Georges, with the power and density of Vosne-Vosne-Romanée. Delicious, concentrated black fruits pair with the acidity and the core of tannins."
France,Burgundy,Olivier Leflaive 2010 Santenots Premier Cru  (Volnay),Pinot Noir,92,90.0,"For the moment, the tannins are still firm and the generous red fruits have not yet penetrated the surface. The acidity is present, like a line of brightness that cuts through this richly tannic wine. This is a potentially opulent wine."
France,Burgundy,Chanson Père et Fils 2009 Clos des Mouches Premier Cru  (Beaune),Pinot Noir,92,112.0,"Opulent and ripe, but at the same time it shows red fruits, fresh acids and a structured core. It has a wonderful, generous finish that showcases the rich fruits and warm tannins."
France,Burgundy,Domaine Faiveley 2010 Les Cazetiers Premier Cru  (Gevrey-Chambertin),Pinot Noir,92,110.0,"This is rich, showing the full-bodied character of a Gevrey-Chambertin Premier Cru. It has a sense of gravity and structure, with a flavor of red-plum jelly. Solid and chunky, this already expresses its fruit, although it does need at least six years to mature."
France,Burgundy,Domaine Perrot-Minot 2010 Champs Perdrix  (Vosne-Romanée),Pinot Noir,92,,"This demonstrates the power, concentration and firm structure that comes from the vintage. The fruit is rich and powered by opulent black fruits, with a dark, intensely textured finish."
France,Burgundy,Jean-Claude Boisset 2009 Lavaut Saint-Jacques Premier Cru  (Gevrey-Chambertin),Pinot Noir,92,75.0,"While it has all the structure of Gevrey-Chambertin, it also has the richness of the vintage. This strikes a healthy balance between the two, creating a powerful wine that's full of black fruits and sweet tannins, with a firm, dry core. Age for 5–6 years."
France,Southwest France,Domaine Rotier 2015 Esquisse Red (Gaillac),Red Blend,87,16.0,"This is a rich wine made to be drunk young. It has spice, a smoky-bacon flavor and warm-hearted red plum and damson fruitiness. The wood aging shows through in hints of toast. The wine is ready now."
France,Burgundy,Albert Morot 2012 Bressandes Premier Cru  (Beaune),Pinot Noir,92,72.0,"This firm, dark and still young wine has intense acidity that comes from the red currant and raspberry fruit. The tannins though form the real basis of this concentrated wine. Great juicy fruits at the end will develop well. Drink from 2018."
France,Burgundy,François Buffet 2014 Les Narbantons Premier Cru  (Savigny-lès-Beaune),Pinot Noir,89,55.0,"This wine is fragrant and ripe while having a balanced, delicate structure. It offers plenty of fruit and acidity, with dusty tannins and sweet berry flavors. It should develop well and quickly. Drink from 2019."
France,Burgundy,Manuel Olivier 2010  Pommard,Pinot Noir,88,49.0,"This is an upright, firm wine that's solidly based around dense tannins as well as ripe red fruits. It has a very dry core giving a concentrated texture that means the wine needs to age. Give it 4–5 years."
France,Loire Valley,Eric Cottat 2014 La Vallée des Vignes  (Sancerre),Pinot Noir,85,20.0,"This wine is ripe, jammy and full of juicy red fruits supported by tannins. The wine is still young, with its bright fruit very much to the fore. Let it round out before drinking, so wait until 2018."
France,Loire Valley,Joseph Mellot 2014 Les Thureaux  (Menetou-Salon),Pinot Noir,85,20.0,"From chalk soil, this wine is textured with tight tannins lying over the red cherry and berry fruits. Not rich, it's more a gentle excursion into Pinot Noir giving freshness as well as that light structure. It offers perfumed acidity at the end."
France,Southwest France,Domaine Laurens 2009 Cuvée de Flars  (Marcillac),Red Blend,87,,"A blend of 20% Cabernet Sauvignon and 80% Fer Servadou, this is the top cuvée from Domaine Laurens. It has a new wood richness and firm tannins, with an herbal character that blends into the blackberry fruit. Age for another year."
France,Loire Valley,Philippe Girard 2014  Sancerre,Pinot Noir,83,26.0,"An earthy tasting wine, this has tannins and hints of soft, perfumed red fruits. Acidity gives the wine freshness although the dry, rustic character is off-putting."
France,Loire Valley,Thibault 2014 Fernand & Sons Pinot Noir (Coteaux du Giennois),Pinot Noir,83,18.0,This earthy wine presents barnyard flavors over the riper red fruit and licorice flavors. Drink now when the fruit is at its best.
France,Burgundy,Jean-Luc and Paul Aegerter 2010 Les Gourmandes  (Chorey-lès-Beaune),Pinot Noir,89,43.0,"Chorey-lès-Beaune, on the plain just north of Beaune, can offer—as here—good value for Burgundy. This wine, still showing some young austerity, has the potential to develop into a bold, fruity selection that will always have a firmer structured edge."
France,Provence,Château la Coste 2010 Les Pentes Douces Red (Coteaux d'Aix-en-Provence),Red Blend,91,,"The wine has considerable acidity that comes from the balance of Syrah and Cabernet Sauvignon in the wine. Bold in tannins and complex in fruit flavors, it's a wine that will develop slowly and well. Drink from 2016."
France,Provence,Mas de la Dame 2009 La Stèle Red (Les Baux de Provence),Red Blend,91,31.0,"This wine is still youthful, but solidly structured, dense and concentrated. It's dry in style but laden with fruits that have only begun to show through. Give this impressive wine several more years in the cellar. Drink from 2016."
France,Burgundy,Louis Jadot 2007 Les Suchots Premier Cru  (Vosne-Romanée),Pinot Noir,92,,"Very smoky aromas, the fruit ripe with sweet blackberry flavors. The wood is still very present, not yet completely integrated; there is a touch of green perhaps from the wood. At the same time, the wine is developing while keeping a fresh streak of acidity."
France,Burgundy,Louis Jadot 2014 Clos de la Commaraine Premier Cru  (Pommard),Pinot Noir,92,79.0,"This rich, firmly structured wine comes from a nine-acre vineyard close to the village of Pommard. Its ripe black fruits are just starting to show through the dry core. Concentrated and powerful, it will be best from 2022."
France,Burgundy,Jaffelin 2010 Les Chapitres de Jaffelin  (Bourgogne),Pinot Noir,84,23.0,"High acidity makes this wine taste bright, fruity and light. There is only a hint of dry tannin to the red currant flavor."
France,Burgundy,L. Tramier & Fils 2015 Laurent Dufouleur Cuvée Grégoire  (Bourgogne),Pinot Noir,88,30.0,Laurent Dufouleur is the current director of Tramier and has created a series of wines under his name. This wood and red-fruit-flavored wine is likely to be attractively ripe and jammy as the wood softens and integrates. There is fine acidity at the end and the wine will be ready to drink from 2019.
France,Burgundy,Maison Jessiaume 2015  Bourgogne,Pinot Noir,88,25.0,"This wine really benefits from the delicious ripe fruit of the vintage. So broad, rich red-berry flavors give the wine a generous character with just the right amount of the balanced acidity. The wine is full, fruity and ready to drink."
France,Burgundy,David Duband 2014  Côte de Nuits-Villages,Pinot Noir,90,50.0,"This ripe wine comes from organic vineyards in the village of Brochon, next to Gevrey-Chambertin. It shows plenty of structure, a tantalizing smoky character from wood aging and juicy red fruit character. This will be a delicious wine to drink from 2018."
France,Champagne,Jean Josselin 2012 Cordon Royal Brut Pinot Noir (Champagne),Pinot Noir,89,45.0,"Made exclusively from Pinot Noir grown in the best parcels of the Josselin vineyard, this Champagne has richness along with hints of maturity. Fruity with citrus and green apple flavors, it has a crisp texture that is just about to soften. Drink from 2018."
France,Burgundy,Chanson Père et Fils 2007 Les Dominodes Premier Cru  (Savigny-lès-Beaune),Pinot Noir,89,,"Lovely perfumed fruit with delicious, soft sweetness, raspberry and sweet plums. The acidity attractively cuts through this ripeness."
France,Burgundy,L. Tramier & Fils 2007 Collection Premier Cru  (Beaune),Pinot Noir,89,50.0,"A dry wine with firm tannins over the juicy red-cherry fruits. It is structured, while likely to develop well over the next few years. The wood and fruit are both attractive at this stage."
France,Burgundy,Maison Champy 2008  Volnay,Pinot Noir,89,,"Rich, velvet-textured wine, this has weight and tannins surrounded by red berry fruits, soft acidity and a lingering sweet aftertaste."
France,Burgundy,Roche de Bellene 2011 Pitures Premier Cru  (Volnay),Pinot Noir,91,74.0,"Showing richness, this wine is smooth and well balanced between ripe red berry fruits and generous tannins. The wood aging shows in a slight burnt edge, but this will pass as the wine develops. Drink from 2016."
France,Loire Valley,Fournier Père et Fils 2006 Les Belles Vignes  (Sancerre),Pinot Noir,86,26.0,"An attractive, soft wine, with a chewy, juicy character. It shows red fruits, a touch of licorice and acidity. The wine is now mature. Drink this year."
France,Alsace,Kuentz-Bas 2014 Tradition Pinot Noir (Alsace),Pinot Noir,90,20.0,"Gentle spice and redcurrant notes promise a subtle wine. The palate does not disappoint and sings with translucent, light-footed elegance. This is all about charm and ease, about chiffon rather than velvet. Crisp freshness brightens and lightens everything. It's a mere whiff of a wine but a delicious one."
France,Champagne,Jean Josselin NV Audace Brut Rosé Pinot Noir (Champagne),Pinot Noir,84,35.0,"Aube-based Jean Josselin specializes in Pinot Noir. This bottling has juicy raspberry flavor, bright acidity and a candied fruit aftertaste. Drink now."
France,France Other,Lacheteau 2015 Tip Top Pinot Noir (Vin de France),Pinot Noir,83,,"This is a simple, fruity wine. Its red cherry fruit is cut with a stalky, crisp texture and layered with acidity. It's made to drink young."
France,Burgundy,L. Tramier & Fils 2015 Collection  (Bourgogne Hautes Côtes de Beaune),Pinot Noir,85,24.0,"This small appellation is in the hills behind the Côte Beaune. The wine has the cool character of many of these wines, with red-currant fruitiness. Layers of acidity give the wine a youthful, ready-to-drink fresh character."
France,Southwest France,Château de Gaudou 2010 Tradition Red (Cahors),Red Blend,88,18.0,"This blend of Merlot, Malbec and Tannat is soft and rich. With its ripe plum fruit, rich texture and soft, dusty tannins, this feels full on the palate. The finish shows crisp acidity."
France,Burgundy,Domaine de Bellene 2014 Les Peuillets Premier Cru  (Savigny-lès-Beaune),Pinot Noir,91,70.0,"From negociant Nicolas Potel's own vines, this wine is dense and smoky. It has spice and hints of licorice as well as rich red-cherry fruit. The tannins and the structure of the wine promise aging, so drink this concentrated wine from 2020."
France,Burgundy,L. Tramier & Fils 2013 Collection  (Corton),Pinot Noir,91,110.0,"With gentle tannins and juicy red fruits this is a ripe wine that is developing fast. It is beginning to get secondary flavors: mushrooms with undergrowth aromas. The fruit is still there, of course, giving red berry and acidity. Drink this wine soon, certainly from late 2017."
